<?xml version="1.0" encoding="UTF-8"?>
<hl7:senderRequest xmlns:hl7="http://w3.ibm.com/it/hl7"
	xmlns:xsi="http://www.w3.org/2001/XMLSchema-instance"
	xsi:schemaLocation="http://w3.ibm.com/it/hl7 HL7Model.xsd ">
	<action>writeParameters</action>
	<writeParametersRequest>
		<measurement>
			<id>12345679</id>
			<userId>CPORTELLI</userId>
			<nosologicId>17/00004</nosologicId>
			<!--Optional fields - INIZIO -->
			<firstname>N/A</firstname>
			<lastname>N/A</lastname>
			<patientIdentifierList>N/A</patientIdentifierList>
			<!--Optional fields - FINE -->
			<patientClass>I</patientClass>
			<date>2017216132159</date>
			<!--Zero or more repetitions: -->
			<values>
				<measureId>0</measureId>
				<measureName>pharmacologicallySedated</measureName>
				<value>0</value>
				<units />
				<type>Integer</type>
			</values>
			<values>
				<measureId>1</measureId>
				<measureName>gcsEye</measureName>
				<value>3.0</value>
				<units />
				<type>Decimal</type>
			</values>
			<values>
				<measureId>2</measureId>
				<measureName>gcsVerbal</measureName>
				<value>2.0</value>
				<units />
				<type>Decimal</type>
			</values>
			<values>
				<measureId>3</measureId>
				<measureName>gcsMotor</measureName>
				<value>1.0</value>
				<units />
				<type>Decimal</type>
			</values>
		</measurement>
	</writeParametersRequest>
</hl7:senderRequest>
